{"format_version":1,"name":"demi.gameplay.projectiles","version":"1.1.0","engine":"^0.1.0","dependencies":{"demi.gameplay.events":"^1.0.0"},"public_modules":["demi.gameplay.hitscan","demi.gameplay.projectiles","demi.gameplay.weapon"],"files":["README.md","scripts/demi/gameplay/hitscan.lua","scripts/demi/gameplay/projectiles.lua","scripts/demi/gameplay/weapon.lua","tests/projectiles_test.lua"],"exported_events":["damage_requested","projectile_spawned","projectile_released"]}
